<!DOCTYPE skills SYSTEM "skill.dtd">
<skills>
	<profession value="ELEMENTALIST">
		<spell type="SPELL">
			<name value="Immolate"/>
			<costs value="10"/>
			<casttime value="1"/>
			<cooldown value="5"/>
			<targettype value="ENEMY"/>
			<effects>
				<impact>
					<damage value="20" scaling="FIRE_MAGIC" type="FIRE">
						<step key="1" value="24"/>
						<step key="2" value="27"/>
					</damage>
          <condition type="BURNING"  value="1" scaling="FIRE_MAGIC">
            <step key="4" value="2"/>
            <step key="12" value="3"/>
          </condition>
				</impact>
			</effects>
		</spell>
	</profession>

	<profession value="MONK">
		<spell type="SPELL">
			<name value="Word of Healing"/>
			<costs value="5"/>
			<casttime value="0.75"/>
			<cooldown value="3"/>
			<targettype value="SELF_ALLY"/>
			<effects>
				<impact>
					<heal value="5" scaling="HEALING_PRAYERS">
						<step key="1" value="11"/>
						<step key="2" value="18"/>
						<step key="3" value="24"/>
					</heal>
					<when value="TARGERT">
						<whencondition>
							<hp value="50" type="-"/>
						</whencondition>
						<then>
							<heal value="30" scaling="HEALING_PRAYERS">
								<step key="1" value="36"/>
								<step key="2" value="41"/>
								<step key="3" value="47"/>
							</heal>
						</then>
					</when>
				</impact>
			</effects>
		</spell>

		<spell type="SPELL">
			<name value="Guardian"/>
			<costs value="5"/>
			<casttime value="1"/>
			<cooldown value="4"/>
			<targettype value="SELF_ALLY"/>
			<effects>
				<impact>
					<buff value="2" type="ENCHANTMENT" scaling="PROTECTION_PRAYERS">
						<step key="2" value="3"/>
						<step key="5" value="4"/>
						<step key="11" value="6"/>
            <block type="ATTACKS" value="50" scaling= "NONE" usage="INF"/>
					</buff>
				</impact>
			</effects>
		</spell>

		<spell type="SPELL">
			<name value="Mend Ailment"/>
			<costs value="5"/>
			<casttime value="0.75"/>
			<cooldown value="5"/>
			<targettype value="SELF_ALLY"/>
			<effects>
				<impact>
					<remove value="1" type="CONDITION" scaling="NONE"/>
					<foreach type="CONDITION">
						<heal value="30" scaling="PROTECTION_PRAYERS">
							<step key="1" value="5"/>
							<step key="2" value="9"/>
							<step key="3" value="14"/>
						</heal>
					</foreach>
				</impact>
			</effects>
		</spell>

	</profession>

	<profession value="WARRIOR">
		<spell type="UNIQUE_BUFF">
			<name value="Shield Bash"/>
			<costs value="5"/>
			<casttime value="0"/>
			<cooldown value="20"/>
			<targettype value="SELF"/>
			<weapon value="SHIELD"/>
      <effects>
        <impact>
			    <buff value="5" type="STANCE" scaling="STRENGHT">
				    <block type="ATTACKSKILLS" value="100" scaling="NONE" usage="1"/>
				    <step key="2" value="6"/>
				    <step key="4" value="7"/>
				    <step key="7" value="8"/>
				    <when value="TARGET">
					    <whencondition>
						    <attack type="MELEEATACKSKILL"/>
					    </whencondition>
					    <then>
                <knockdown value="2" scaling="NONE"/>
                <skillcooldown value="15" scaling="NONE"/>
					    </then>	
				    </when>
			    </buff>
        </impact>
      </effects>
		</spell>
	</profession>

	<profession value="DERWISH">
		<spell type="SPELL">
			<name value="Mystic Regeneration"/>
			<costs value="10"/>
			<casttime value="0.25"/>
			<cooldown value="12"/>
			<targettype value="SELF"/>
      <effects>
        <impact>
			    <buff value="5" type="ENCHANTMENT" scaling="EARTH_PRAYERS">
				    <step key="1" value="6"/>
				    <step key="2" value="7"/>
				    <step key="3" value="8"/>
				    <foreach type="ENCHANTMENT">
              <regeneration value="1" scaling="EARTH_PRAYERS" type="HEALTH">
						    <step key="3" value="2"/>
						    <step key="8" value="3"/>
					    </regeneration>
				    </foreach>
			    </buff>
        </impact>
      </effects>
		</spell>
	</profession>
</skills>