<!DOCTYPE skills SYSTEM "skill.dtd">
<skills>
  <profession value="PARAGON">
    <spell type="RANGEATTACK">
      <name value="Barbed Spear"/>
      <costs value="2" type="ADRENALINE"/>
      <casttime value="0"/>
      <cooldown value="0"/>
      <targettype value="ENEMY"/>
      <range value="800"/>
      <weapon value="SPEAR"/>
      <effects>
        <impact>
          <condition value="5" scaling="SPEAR_MASTERY" target="TARGET" type="BLEEDING">
            <step key="1" value="6"/>
            <step key="2" value="7"/>
            <step key="3" value="8"/>
            <step key="4" value="9"/>
            <step key="5" value="10"/>
            <step key="6" value="11"/>
            <step key="7" value="12"/>
            <step key="8" value="13"/>
            <step key="9" value="14"/>
            <step key="10" value="15"/>
            <step key="11" value="16"/>
            <step key="12" value="17"/>
            <step key="13" value="18"/>
            <step key="14" value="19"/>
          </condition>
        </impact>
      </effects>
    </spell>

    <spell type="RANGEATTACK">
      <name value="Maiming Spear"/>
      <costs value="5" type="MANA"/>
      <casttime value="0"/>
      <cooldown value="5"/>
      <targettype value="ENEMY"/>
      <range value="800"/>
      <weapon value="SPEAR"/>
      <effects>
        <impact>
          <when value="TARGET">
            <whencondition>
              <condi type="BLEEDING"/>
            </whencondition>
            <then>
              <condition value="5" scaling="SPEAR_MASTERY" target="TARGET" type="CRIPPLED">
                <step key="1" value="6"/>
                <step key="2" value="7"/>
                <step key="3" value="8"/>
                <step key="4" value="9"/>
                <step key="5" value="10"/>
                <step key="6" value="11"/>
                <step key="7" value="12"/>
                <step key="8" value="13"/>
                <step key="9" value="14"/>
                <step key="10" value="15"/>
                <step key="11" value="16"/>
                <step key="12" value="17"/>
                <step key="13" value="18"/>
                <step key="14" value="19"/>
              </condition>
            </then>
          </when>
        </impact>
      </effects>
    </spell>

    <spell type="RANGEATTACK">
      <name value="Blazing Spear"/>
      <costs value="6" type="ADRENALINE"/>
      <casttime value="0"/>
      <cooldown value="0"/>
      <targettype value="ENEMY"/>
      <range value="800"/>
      <weapon value="SPEAR"/>
      <effects>
        <impact>
          <damage value="5" scaling="SPEAR_MASTERY" target="TARGET" type="ATTACK">
            <step key="1" value="6"/>
            <step key="2" value="8"/>
            <step key="3" value="9"/>
            <step key="4" value="10"/>
            <step key="5" value="12"/>
            <step key="6" value="13"/>
            <step key="7" value="14"/>
            <step key="8" value="16"/>
            <step key="9" value="17"/>
            <step key="10" value="18"/>
            <step key="11" value="20"/>
            <step key="12" value="21"/>
            <step key="13" value="22"/>
            <step key="14" value="24"/>
          </damage>
          <condition value="1" scaling="SPEAR_MASTERY" target="TARGET" type="BURNING">
            <step key="4" value="2"/>
            <step key="12" value="3"/>
          </condition>
        </impact>
      </effects>
    </spell>
  </profession>
</skills>